{
  "request_version": "build/v1",
  "generator": "geometric-character@1.0.0",
  "spec": {
    "spec_version": "character/v1",
    "name": "Facet Bot Tidepool",
    "slug": "facet-bot-tidepool",
    "style": "geometric",
    "height_mm": 95,
    "pose": "standing",
    "palette": ["#176B87", "#DAFFFB"],
    "proportions": {
      "head_scale": 1.2,
      "body_scale": 0.95,
      "limb_scale": 0.95
    },
    "material_preset": "satin",
    "eye_preset": "round",
    "components": ["antenna-pair", "chest-badge"],
    "base": {
      "preset": "round",
      "width_mm": 52,
      "depth_mm": 52,
      "height_mm": 5
    }
  },
  "output_profile": "complete-v1",
  "render_profile": "diagnostic-v1",
  "quality_profile": "geometry-v1"
}
